{
  "$schema": "http://json-schema.org/draft-07/schema#",
  "title": "Application",
  "type": "object",
  "properties": {
    "kind": {
      "type": "string",
      "maxLength": 32
    },
    "name": {
      "type": "string",
      "maxLength": 128
    },
    "description": {
      "type": "string",
      "maxLength": 4096
    },
    "version": {
      "type": "string",
      "pattern": "^(0|[1-9]\\d*)\\.(0|[1-9]\\d*)\\.(0|[1-9]\\d*)$"
    },
    "configuration": {
      "type": "object",
      "properties": {
        "specification": {
          "type": "object",
          "patternProperties": {
            "^specification_[a-z]{3}$": {
              "type": "string"
            }
          },
          "additionalProperties": false
        },
        "settings": {
          "type": "object",
          "patternProperties": {
            "^setting_[a-z]{3}$": {
              "type": "string"
            }
          },
          "additionalProperties": false
        }
      },
      "required": ["specification", "settings"]
    }
  },
  "required": ["kind", "name", "description", "version", "configuration"]
}
